[
  {"id":"COMPANION-NO-RUN-ANIM-33","title":"The companion slides instead of walking or running, and mimic mode does not mirror the gait","state":"closed","fixed_in":null,"owner_accepted":null,"status":"Closed: duplicate of NPC-NO-RUN-ANIM-35 (same symptom and cause: residents built with the idle-only profile, no walk or run frames).","report":"bugs/COMPANION-NO-RUN-ANIM-33.md","reported_by":"owner","found_date":"2026-10-09","found_in":"v0.0.33-rc1","where":"resident models (idle-only default profile); aw_companion.c animate; aw_npcpath.c","reproduction":"always","duplicate_of":"NPC-NO-RUN-ANIM-35","persists_in":["v0.0.33-rc1"],"severity":"medium","severity_reason":"The follower moves with an idle pose: it visibly slides behind the player.","family":"actors-npc","related":[],"build":{"name":"v0.0.33-rc1","source_commit":"7ae3ea7","engine_commit":"7ae3ea7","world_commit":"unknown","chim_version":"0.1.0","chim_format":"unknown","unknown_reason":"maintainer playtest report names no image commit or world format"}},
  {"id":"NPC-ANIM-IDLE-ONLY-33","title":"NPCs have only an 8-frame idle: walking, running, swimming, hit and death are not animated","state":"fixed","fixed_in":"v0.0.35","owner_accepted":null,"status":"Fixed in v0.0.35: animation kit default on (1560d59, fb08343); walk groups animated; running and gait quality is tracked in NPC-NO-RUN-ANIM-35.","report":"bugs/NPC-ANIM-IDLE-ONLY-33.md","reported_by":"owner","found_date":"2026-10-09","found_in":"v0.0.33-dev","where":"tools/prepare_area.py build_resident (idle_times(8) only); engine/aga/src/aw_companion.c","reproduction":"always","duplicate_of":null,"persists_in":"fixed in v0.0.35","severity":"medium","severity_reason":"A walking companion or fighter slides in its idle pose; no footsteps","family":"actors-npc","related":[]},
  {"id":"CHIM-WORLD-AUDIT-SCALING-33","title":"The CHIM world audits grow much faster than the world: the heap gate took 3.6 s for 171 frames, 473 s for 331, and over an hour for 844","state":"fixed","fixed_in":"v0.0.35","owner_accepted":null,"status":"Fixed in v0.0.35 (2ad272a, d23217e; test_chim_heap.py): the per-frame heap audit runs in parallel and is cached; audit time against frame count is now available from the 1,351-frame builds.","report":"bugs/CHIM-WORLD-AUDIT-SCALING-33.md","reported_by":"developer","found_date":"2026-10-09","found_in":"v0.0.33-dev","where":"tools/chim/heap.py require_heap and tools/chim/validate.py on many frames","reproduction":"always","duplicate_of":null,"persists_in":"fixed in v0.0.35","severity":"medium","severity_reason":"An island-wide world (1,292 frames) cannot be audited in reasonable time; CHIMport builds its growing world only after the last ring for now.","family":"chim-streamer","related":[],"tags":["performance"],"chim":"builder","build":{"name":"source","source_commit":"0580012","engine_commit":"0580012","world_commit":"unknown","chim_version":"0.1.0","chim_format":"0.5","unknown_reason":"found in source by CHIMport (growing CHIM worlds, not a numbered build)"}},
  {"id":"MINIWIND-NO-WINUAE-PROFILE-33","title":"MiniWind playtest packages ship only an FS-UAE profile: no WinUAE profile and no launcher","state":"closed","fixed_in":null,"owner_accepted":null,"status":"2026-10-20 audit: superseded, Per-image WinUAE config + launcher written by the build end step (3f68791); applies to MiniWind images too.","report":"bugs/MINIWIND-NO-WINUAE-PROFILE-33.md","reported_by":"owner","found_date":"2026-10-09","found_in":"v0.0.33-dev","where":"Private playtest packaging of MiniWind builds (the package step after the builder's image)","reproduction":"always","duplicate_of":null,"persists_in":["v0.0.33-dev"],"severity":"low","severity_reason":"The package boots in FS-UAE; WinUAE users must write their own configuration","family":"boot-startup","related":[],"chim":"builder","build":{"name":"v0.0.33-dev1 MiniWind #3","source_commit":"c4e14ab","engine_commit":"c4e14ab","world_commit":"c4e14ab","chim_version":"0.1.0","chim_format":"0.5"}},
  {"id":"BENCH-FSUAE-PLAIN-HDF-32","title":"FS-UAE does not mount a plain 1.5 GiB partition hard file","state":"closed","fixed_in":null,"owner_accepted":null,"status":"2026-10-20 audit: superseded, Emulator behaviour: large benchmark disks use an RDB wrapper (verified 8 Oct); v0.0.45 image is an RDB HDF with DH0/DW0/DW1.","report":"bugs/BENCH-FSUAE-PLAIN-HDF-32.md","reported_by":"developer","found_date":"2026-10-08","found_in":"v0.0.33-dev","where":"FS-UAE hard file handling for large benchmark disks","reproduction":"always","duplicate_of":null,"persists_in":["v0.0.33-dev"],"severity":"low","severity_reason":"Emulator behaviour; large benchmark disks use an RDB wrapper as a workaround.","family":"disk-image-layout","related":[]},
  {"id":"AUDIO-HOST-LOAD-33","title":"Music and sound crackle when the emulator shares a fully loaded host CPU","state":"closed","fixed_in":null,"owner_accepted":null,"status":"2026-10-20 audit: superseded, Host CPU starvation of the emulator, not game data (register 16 Oct); propose closing as external unless an idle-vs-loaded same-PC listening A/B shows otherwise.","report":"bugs/AUDIO-HOST-LOAD-33.md","reported_by":"owner","found_date":"2026-10-09","found_in":"v0.0.33-dev","where":"Emulator audio output on a host PC whose CPU is saturated by other work","reproduction":"sometimes","duplicate_of":null,"persists_in":["v0.0.33-dev"],"severity":"low","severity_reason":"Test environment only: the game is clean on an unloaded PC; misleads audio playtests.","family":"audio","related":["BENCH-JIT-PROFILE-32"],"build":{"name":"CHIM Preview 1","source_commit":"0f467e4b907e28930e323b31a9db2fcfc17c1c47","engine_commit":"0d8bf4feacbf6563485e712ffd1ca4201391c25d","world_commit":"unknown","chim_version":"0.1.0","chim_format":"0.4","unknown_reason":"the CHIM world receipt records no commit (CHIM-RECEIPT-COMMIT-33)"}},
  {"id":"BUILD-ROUTED-FLORA-RESERVE-33","title":"Routed standing hulls push a legacy open-world map past the flora collision reserve: the full build stops in world-flora (vf0779)","state":"closed","fixed_in":null,"owner_accepted":null,"status":"2026-10-20 audit: superseded, vf0779 (the named failure) is now a CHIM region frame map: B45 'CHIM region frame maps: vf0779.chim: reused', 'frame-map heap vf0779: active ring 3,416,640 of 6,242,304 B'. The legacy world-flora c...","report":"bugs/BUILD-ROUTED-FLORA-RESERVE-33.md","reported_by":"build","found_date":"2026-10-09","found_in":"v0.0.33-dev","where":"world-flora collision packing (prepare_world_flora.py), region vf0779","reproduction":"always","duplicate_of":null,"persists_in":["v0.0.33-dev"],"severity":"high","severity_reason":"The full build stops; one of 2,532 open-world regions","family":"stairs-collision","related":["BUILD-FLORA-FALLBACK-RETRY-35","ROUTED-HULL-NODE-ORDER-33"],"build":{"name":"v0.0.33 pass 2 full build (p2g-628d39f)","source_commit":"628d39f","engine_commit":"628d39f","world_commit":"628d39f","chim_version":"0.1.0","chim_format":"0.5"},"reports":[{"version":"v0.0.36-dev5","at":"2026-10-11 14:29 +0300","note":"PERSISTING: vf0779 again, aggregate flora packing 33,172 clipnodes after the stair plate rule (e532b0e)"}]},
  {"id":"CHIM-SEYDA-ACTOR-CONTACT-33","title":"rc1 image step refuses Seyda Neen's CHIM frame map: six actors stand 0.8-3.3 units off the CHIM ground","state":"fixed","fixed_in":"v0.0.41","owner_accepted":null,"status":"2026-10-20 audit: v0.0.45 build: stage actor-contact passed (annotate 3.1 s, bake ground 13.5 s, check 6.6 s) and 'Image: actor ground check' done in 9.4 s with Seyda CHIM-native; actor-ground-acceptance.json written in the image folde...","report":"bugs/CHIM-SEYDA-ACTOR-CONTACT-33.md","reported_by":"build","found_date":"2026-10-09","found_in":"v0.0.33-rc1","where":"image step, tools/chim/frame_map.py actor_contact, Seyda Neen frame","reproduction":"always","duplicate_of":null,"persists_in":"fixed in v0.0.41","severity":"critical","severity_reason":"The release candidate build stops","family":"chim-streamer","related":["CHIM-ACTOR-GROUNDING-POLICY-36","CHIM-TERRAIN-DIAGONAL-40","CHIM-VIVEC-FRAME-WIDE-41","ROOM-ACTORS-FLOATING-48"],"chim":"streaming","build":{"name":"v0.0.33-rc1 from-scratch build (rc1-a18be05)","source_commit":"a18be05","engine_commit":"a18be05","world_commit":"a18be05","chim_version":"0.1.0","chim_format":"0.5"},"reports":[{"version":"v0.0.41-dev2","at":"2026-10-16 02:31 +0300","note":"Nels Llendo also unsupported in the Vivec frame"}]},
  {"id":"ARENA-PIT-NO-INTERIOR-33","title":"The Vivec Arena minigame fights on the test floor: the Arena Pit interior is not in v0.0.33 builds","state":"fixed","fixed_in":"v0.0.35","owner_accepted":null,"status":"Fixed in v0.0.35: the Arena Pit interior (vai000) ships; since v0.0.36 the builder makes it as a CHIM town room (300e8dd) with the vivec-arena-pit MiniWind preset.","report":"bugs/ARENA-PIT-NO-INTERIOR-33.md","reported_by":"owner","found_date":"2026-10-09","found_in":"v0.0.33-rc1","where":"engine/aga/src/aw_arena.c fallback; builder (Arena withdrawn from v0.0.33)","reproduction":"always","duplicate_of":null,"persists_in":"fixed in v0.0.35","severity":"low","severity_reason":"Intended for v0.0.33 (the Arena was withdrawn); the fight works on the gallery floor, but nothing on screen says why.","family":"build-content-missing","related":[],"build":{"name":"v0.0.33-rc1","source_commit":"7ae3ea7","engine_commit":"7ae3ea7","world_commit":"unknown","chim_version":"0.1.0","chim_format":"unknown","unknown_reason":"owner playtest report names no image commit or world format","note":"owner playtest of a v0.0.33 build; the exact image commit is not in the report"}},